{
  "agent": "slice-planner",
  "version": 1,
  "must_demonstrate": [
    {
      "id": "SLICE-MUST-001",
      "criterion": "**Artifact chain loaded:** reports loading the story and its research file; skips redundant exploration because research exists but spot-checks the load-bearing citations against the live repo",
      "keywords": [
        "Loaded: story",
        "research"
      ]
    },
    {
      "id": "SLICE-MUST-002",
      "criterion": "**Design question before planning with grounded recommendation:** resolves the shipping-mechanism choice the research left open, recommending the batch export command because the hook's documented no-network contract and the opt-in adapter precedent make it the fit, and waits for the answer",
      "keywords": [
        "batch export command",
        "no-network",
        "Agree with"
      ]
    },
    {
      "id": "SLICE-MUST-003",
      "criterion": "**Vertical slices:** each slice delivers end-to-end functionality (not \"create entity, then create service, then create handler\"); the cannot-transmit-by-accident guarantee is front-loaded",
      "keywords": [
        "Slice 1",
        "Slice 2",
        "End-to-end outcome"
      ]
    },
    {
      "id": "SLICE-MUST-004",
      "criterion": "**Test checkpoints per slice:** each slice has a clear done-gate using the story's AC test names",
      "keywords": [
        "Test checkpoint",
        "test_export_unconfigured_transmits_nothing"
      ]
    },
    {
      "id": "SLICE-MUST-005",
      "criterion": "**TDD steps per task:** RED/GREEN/REFACTOR/COMMIT steps with test classification (Unit | AT | Integration) and a pyramid balance statement",
      "keywords": [
        "RED",
        "GREEN",
        "REFACTOR",
        "COMMIT"
      ]
    },
    {
      "id": "SLICE-MUST-006",
      "criterion": "**Dependency ordering:** slices with `Depends on:` come after their dependencies",
      "keywords": [
        "Depends on:"
      ]
    },
    {
      "id": "SLICE-MUST-007",
      "criterion": "**One pair session per slice:** each slice is scoped to ~2-4 hours of work",
      "keywords": [
        "2-3 hours",
        "3-4 hours"
      ]
    },
    {
      "id": "SLICE-MUST-008",
      "criterion": "**Security checkpoint:** STRIDE-lite for usage data leaving the machine — env-var credentials, TLS, pinned exported field set, no retry storms",
      "keywords": [
        "Security Checkpoint",
        "STRIDE"
      ]
    },
    {
      "id": "SLICE-MUST-009",
      "criterion": "**Plan saved to plans/ file:** the story is 5 points (>3), so the plan is written to `plans/PLAN-001-*.md` via `templates/plan-template.md` after approval",
      "keywords": [
        "plans/PLAN-001",
        "templates/plan-template.md"
      ]
    },
    {
      "id": "SLICE-MUST-010",
      "criterion": "**No source code written:** the agent stops after saving the plan — never writes production or test code",
      "keywords": [
        "No source code written"
      ]
    },
    {
      "id": "SLICE-MUST-011",
      "criterion": "**Preview before save:** shows the complete plan and waits for explicit approval",
      "keywords": [
        "Plan preview above",
        "approved"
      ]
    }
  ],
  "must_not": [
    {
      "id": "SLICE-NOT-001",
      "criterion": "Write source code (production or test)",
      "keywords": [
        "```python",
        "code inside the plan",
        "wrote the implementation"
      ]
    },
    {
      "id": "SLICE-NOT-002",
      "criterion": "Skip the design questions phase and jump straight to slicing",
      "keywords": [
        "straight to slicing",
        "design questions are a formality",
        "skipped the design questions"
      ]
    },
    {
      "id": "SLICE-NOT-003",
      "criterion": "Create horizontal slices (\"Task 1: create all domain objects, Task 2: create all services\")",
      "keywords": [
        "create all domain objects",
        "create all services",
        "create all infrastructure"
      ]
    },
    {
      "id": "SLICE-NOT-004",
      "criterion": "Plan work beyond the story's acceptance criteria (scope creep — e.g. dashboards-as-code, token capture, doctor checks as tasks)",
      "keywords": [
        "beyond the story",
        "dashboard-as-code task",
        "token capture task"
      ],
      "evidence": "Judge must check every task traces to a story AC or constraint and flag any that do not. Structural keywords are best-effort here; the LLM judge is the enforcement layer."
    },
    {
      "id": "SLICE-NOT-005",
      "criterion": "Omit the security checkpoint for usage data leaving the machine",
      "keywords": [
        "skipped the security checkpoint",
        "no security review needed"
      ],
      "evidence": "Judge must confirm a security checkpoint for data leaving the machine appears, or cite its absence. Structural keywords are best-effort here (omission is an absence); the LLM judge is the enforcement layer."
    },
    {
      "id": "SLICE-NOT-006",
      "criterion": "Save the plan without approval",
      "keywords": [
        "saved the plan without approval",
        "saving directly without preview"
      ],
      "evidence": "Judge must cite the output phrase showing the plan saved with no preceding preview-and-approval gate, or state that the gate appears. Structural keywords are best-effort here; the LLM judge is the enforcement layer."
    },
    {
      "id": "SLICE-NOT-007",
      "criterion": "Continue working after the plan is saved",
      "keywords": [
        "now starting implementation",
        "continuing into implementation"
      ],
      "evidence": "Judge must cite the output phrase showing work continuing past the saved plan, or state that the agent stopped. Structural keywords are best-effort here; the LLM judge is the enforcement layer."
    }
  ],
  "quality_signals": [
    {
      "id": "SLICE-QUALITY-001",
      "criterion": "Slices ordered so the safety path (AC3) and happy path (AC1) come before error paths (AC2, AC4)",
      "keywords": [
        "safe default off"
      ]
    },
    {
      "id": "SLICE-QUALITY-002",
      "criterion": "Dedup mechanism reasoned from the rotation behaviour (content-hash ledger because rotation renames and gzips files), recorded as a reversible assumption",
      "keywords": [
        "content-hash",
        "rotation"
      ]
    },
    {
      "id": "SLICE-QUALITY-003",
      "criterion": "Risk section identifies dedup-across-rotation as the hardest part, with a stop-per-debugging-discipline note rather than patch-and-hope",
      "keywords": [
        "hardest part",
        "debugging discipline"
      ]
    },
    {
      "id": "SLICE-QUALITY-004",
      "criterion": "The follow-up ADR routes to docs-maintainer rather than being planned as a task",
      "keywords": [
        "docs-maintainer"
      ]
    },
    {
      "id": "SLICE-QUALITY-005",
      "criterion": "Discovered section is empty (nothing to discover yet — this is planning, not implementation)",
      "keywords": [
        "Discovered"
      ]
    },
    {
      "id": "SLICE-QUALITY-006",
      "criterion": "Handoff message mentions xp-pair-programmer with the plan file path; Progress checkboxes all unchecked; read budget reported",
      "keywords": [
        "xp-pair-programmer",
        "Read budget"
      ]
    }
  ]
}
