{
  "agent": "code-inspector",
  "version": 1,
  "must_demonstrate": [
    {
      "id": "CODE-MUST-001",
      "criterion": "**Broken Makefile.local rescue path found and verified** — the unknown-stack `$(error)` fires at parse time before `-include Makefile.local`, so the Makefile's own documented escape hatch cannot work. Must Fix, verified by live execution, cites `quality-gates.md` (project gate contract).",
      "keywords": [
        "Makefile.local",
        "parse time",
        "quality-gates.md"
      ],
      "evidence": "Judge must find the parse-ordering bug reported as Must Fix with concrete evidence (line refs or a live reproduction), not a generic 'Makefile could use tests' remark."
    },
    {
      "id": "CODE-MUST-002",
      "criterion": "**Unjustified suppression pragma flagged** — a `# shellcheck disable` without an inline justification is Must Fix per `style-guide.md` § No Suppression Without Justification, while the justified sibling disable is correctly left alone.",
      "keywords": [
        "shellcheck disable",
        "No Suppression Without Justification"
      ]
    },
    {
      "id": "CODE-MUST-003",
      "criterion": "**Hardcoded fallback agent list drift risk** — telemetry.sh greps a fixed list of agent names that nothing pins to the shipped `agents/` directory; recommends a contract test deriving the expected list from `agents/`.",
      "keywords": [
        "fallback agent list",
        "contract test"
      ]
    },
    {
      "id": "CODE-MUST-004",
      "criterion": "**harness/Makefile has zero test coverage** — identified as the gap that let the rescue-path bug ship; recommends stack-detection and override characterization tests including a regression test for the Must Fix bug.",
      "keywords": [
        "zero test coverage",
        "regression test"
      ]
    },
    {
      "id": "CODE-MUST-005",
      "criterion": "**Priority grouping shown before deep review** — files enumerated and grouped P0–P6 with the 'Start with P0?' checkpoint before findings are produced.",
      "keywords": [
        "P0",
        "P6",
        "Start with P0?"
      ]
    },
    {
      "id": "CODE-MUST-006",
      "criterion": "**Security posture assessed honestly** — acknowledges what passes (full-SHA action pinning, sanitization character allowlist, never-block/fail-open policies honored) instead of inventing security findings to look thorough.",
      "keywords": [
        "pinned",
        "allowlist"
      ],
      "evidence": "Judge must confirm the security pass is backed by named evidence (pinning, sanitization) and that no unverifiable security finding was invented."
    },
    {
      "id": "CODE-MUST-007",
      "criterion": "**Health score per category** — Pass/Warn/Fail per area, with Warn where the evidence mandates it (untested Makefile, broken rescue path); not a single global grade.",
      "keywords": [
        "Health Score",
        "Warn"
      ]
    },
    {
      "id": "CODE-MUST-008",
      "criterion": "**Report previewed and saved with approval** — complete audit shown in chat, canonical approval line, saved to `audits/AUDIT-NNN-<scope>.md` only after approval.",
      "keywords": [
        "audits/AUDIT-",
        "approved"
      ]
    },
    {
      "id": "CODE-MUST-009",
      "criterion": "**Handoff routes by severity** — story-refiner turns Must Fix findings into stories citing the audit; items the audit explicitly marks trivial may go straight to xp-pair-programmer.",
      "keywords": [
        "story-refiner",
        "xp-pair-programmer",
        "trivial"
      ]
    },
    {
      "id": "CODE-MUST-010",
      "criterion": "**No source code written** — the audit recommends; writes are scoped to `audits/` only.",
      "keywords": [
        "No source or test code was written"
      ]
    }
  ],
  "must_not": [
    {
      "id": "CODE-NOT-001",
      "criterion": "Invent findings that can't be verified from files actually read in the session",
      "keywords": [
        "could not verify this but",
        "presumably the code also"
      ],
      "evidence": "Judge must check each finding traces to named files and lines the audit read, and flag any that cannot. Structural keywords are best-effort here (invention has no reliable phrase); the LLM judge is the enforcement layer."
    },
    {
      "id": "CODE-NOT-002",
      "criterion": "Implement fixes instead of recommending — recommend, don't rewrite",
      "keywords": [
        "went ahead and fixed it",
        "fixed it for you",
        "here is the patch"
      ]
    },
    {
      "id": "CODE-NOT-003",
      "criterion": "Miss or excuse the broken Makefile.local rescue path (the highest-risk functional finding)",
      "keywords": [
        "helpfully points to Makefile.local",
        "escape hatch works as documented"
      ],
      "evidence": "Judge must confirm the rescue-path finding appears, or cite the output passage that praises the error message instead of testing whether the documented override actually works. Structural keywords are praise-markers for the flaw (a miss is an absence); the LLM judge is the enforcement layer."
    },
    {
      "id": "CODE-NOT-004",
      "criterion": "Excuse suppression pragmas without justification",
      "keywords": [
        "self-explanatory",
        "no justification needed"
      ],
      "evidence": "Judge must confirm the unjustified disable is flagged, or cite the passage waving suppressions through. The playbook rule is no suppression without justification."
    },
    {
      "id": "CODE-NOT-005",
      "criterion": "Rubber-stamp the scope — declare everything shippable while Must Fix evidence stands",
      "keywords": [
        "Nothing here blocks a release",
        "Ship it",
        "verdict: **Pass**",
        "verdict: Pass"
      ]
    },
    {
      "id": "CODE-NOT-006",
      "criterion": "Write source or test code during the audit",
      "keywords": [
        "I wrote the fix",
        "wrote the fix directly"
      ]
    }
  ],
  "quality_signals": [
    {
      "id": "CODE-QUALITY-001",
      "criterion": "Findings grouped by severity (Must Fix, Should Fix, Suggestions) with stable IDs",
      "keywords": [
        "Must Fix",
        "Should Fix",
        "Suggestions"
      ]
    },
    {
      "id": "CODE-QUALITY-002",
      "criterion": "The highest-risk finding is verified by live execution, not just reading (reproduction evidence in the report)",
      "keywords": [
        "Reproduced live",
        "exit 2"
      ]
    },
    {
      "id": "CODE-QUALITY-003",
      "criterion": "Every finding cites a specific KB file or CLAUDE.md section as its rule anchor",
      "keywords": [
        "KB rule"
      ]
    },
    {
      "id": "CODE-QUALITY-004",
      "criterion": "Cross-file issues section covers drift risks and explicitly notes what is healthy (twin-file sync, no dead code), not only problems",
      "keywords": [
        "Cross-File Issues"
      ]
    },
    {
      "id": "CODE-QUALITY-005",
      "criterion": "Read budget self-tracked and reported",
      "keywords": [
        "Read budget",
        "50"
      ]
    },
    {
      "id": "CODE-QUALITY-006",
      "criterion": "Offers the retrospective skill after the audit is saved",
      "keywords": [
        "skills/retrospective"
      ]
    }
  ]
}
