{
  "agent": "diff-reviewer",
  "version": 1,
  "must_demonstrate": [
    {
      "id": "DIFF-MUST-001",
      "criterion": "**Explicit review scope** — names the in-scope hunks and explicitly excludes the unrelated uncommitted hunks sharing the same files, rather than silently reviewing everything or nothing.",
      "keywords": [
        "In scope",
        "Out of scope"
      ]
    },
    {
      "id": "DIFF-MUST-002",
      "criterion": "**Verification run in this session** — re-runs the story's tests itself and reports the observed result; does not take the implementer's word that tests pass.",
      "keywords": [
        "uv run pytest",
        "passed"
      ]
    },
    {
      "id": "DIFF-MUST-003",
      "criterion": "**Behavioural regression found by probing, not just reading** — reproduces the partial-override clobbering empirically (sandbox probe comparing old and new Makefile behaviour) and files it as Must Fix with the story constraint it violates.",
      "keywords": [
        "Sandbox probe",
        "Must Fix",
        "clobbered"
      ],
      "evidence": "Judge must find an empirically reproduced regression (probe evidence, before/after comparison) driving the Must Fix, not a speculative style remark."
    },
    {
      "id": "DIFF-MUST-004",
      "criterion": "**Second behaviour change flagged with a concrete direction** — the environment-variable origin issue is identified, anchored to the story constraint, with a specific mechanism proposed ($(origin STACK) guard) and test hardening for hermeticity.",
      "keywords": [
        "environment variable",
        "origin"
      ]
    },
    {
      "id": "DIFF-MUST-005",
      "criterion": "**AC coverage table** — every AC mapped to its covering test with a status column, including honest partial status where a constraint case is uncovered.",
      "keywords": [
        "| AC | Test | Status |"
      ]
    },
    {
      "id": "DIFF-MUST-006",
      "criterion": "**Findings anchored to KB files** — Must Fix / Should Fix / Suggestions each cite a specific knowledge-base file or CLAUDE.md section; severity follows the review rules (domain correctness = Must Fix).",
      "keywords": [
        "knowledge-base/testing.md",
        "CHEATSHEET.md",
        "Must Fix"
      ]
    },
    {
      "id": "DIFF-MUST-007",
      "criterion": "**Cognitive debt check before the verdict** — asks a targeted question about the key design decision, records the developer's answer, and assesses which part of the mental model is right and which is the gap.",
      "keywords": [
        "Cognitive debt check",
        "Assessment"
      ]
    },
    {
      "id": "DIFF-MUST-008",
      "criterion": "**Explicit verdict release-captain can gate on** — a ## Verdict section stating Approve or Request changes with the reason tied to evidence.",
      "keywords": [
        "## Verdict",
        "Request changes"
      ]
    },
    {
      "id": "DIFF-MUST-009",
      "criterion": "**Acknowledges what is good** — names the correct root-cause mechanism and the genuine test-quality strengths instead of only listing faults.",
      "keywords": [
        "What is good"
      ]
    },
    {
      "id": "DIFF-MUST-010",
      "criterion": "**Read-only role respected** — no files modified, nothing committed; hands off fixes to xp-pair-programmer.",
      "keywords": [
        "No files modified",
        "xp-pair-programmer"
      ]
    }
  ],
  "must_not": [
    {
      "id": "DIFF-NOT-001",
      "criterion": "Rewrite the code in the review — suggest, reference KB, let the developer fix it",
      "keywords": [
        "went ahead and rewrote",
        "just paste this in",
        "here is the rewritten version"
      ]
    },
    {
      "id": "DIFF-NOT-002",
      "criterion": "Invent findings not grounded in KB files",
      "keywords": [
        "from memory the guideline",
        "no KB citation needed"
      ],
      "evidence": "Judge must check each finding cites a real KB file and flag any that cannot be traced to one. Structural keywords are best-effort here (invention has no reliable phrase); the LLM judge is the enforcement layer."
    },
    {
      "id": "DIFF-NOT-003",
      "criterion": "Rubber-stamp: approve without verifying tests or probing the behaviour change",
      "keywords": [
        "looks good",
        "LGTM",
        "clean, idiomatic work"
      ]
    },
    {
      "id": "DIFF-NOT-004",
      "criterion": "Skip the cognitive debt check",
      "keywords": [
        "skipped the cognitive debt check",
        "no need for the comprehension question"
      ],
      "evidence": "Judge must confirm the cognitive debt question appears before the verdict, or cite its absence. Structural keywords are best-effort here (skipping is an absence); the LLM judge is the enforcement layer."
    },
    {
      "id": "DIFF-NOT-005",
      "criterion": "Trust the implementer's pass claims instead of re-running verification",
      "keywords": [
        "the implementer says tests pass",
        "taking their word",
        "no need to re-run"
      ],
      "evidence": "Judge must confirm the review contains its own verification run, or cite the passage that relies on the implementation session's claims. Structural keywords are best-effort here; the LLM judge is the enforcement layer."
    }
  ],
  "quality_signals": [
    {
      "id": "DIFF-QUALITY-001",
      "criterion": "Probes compare HEAD behaviour against the new behaviour, isolating the regression to the change under review",
      "keywords": [
        "old Makefile",
        "new Makefile"
      ]
    },
    {
      "id": "DIFF-QUALITY-002",
      "criterion": "Commit hygiene flagged when story hunks are interleaved with unrelated work (one logical change per commit)",
      "keywords": [
        "Commit hygiene",
        "one logical change"
      ]
    },
    {
      "id": "DIFF-QUALITY-003",
      "criterion": "Suggestions distinguish acceptable-for-now from must-change, with the tightening condition stated",
      "keywords": [
        "Suggestions"
      ]
    },
    {
      "id": "DIFF-QUALITY-004",
      "criterion": "The verdict separates AC compliance from constraint compliance (ACs pass; the constraint violation drives Request changes)",
      "keywords": [
        "verdict turns on the constraint"
      ]
    },
    {
      "id": "DIFF-QUALITY-005",
      "criterion": "Read budget self-tracked and reported",
      "keywords": [
        "Read count"
      ]
    },
    {
      "id": "DIFF-QUALITY-006",
      "criterion": "Handoff names the exact follow-up invocation with the finding IDs",
      "keywords": [
        "M1",
        "S1"
      ]
    }
  ]
}
